frugal,절약하는 ,People must be frugal with money during an economic downturn.,경기 침체 동안 사람들은 돈을 절약해야 한다.,People must be _ with money during an economic downturn.,,frugal
cut down on,(비용쉼표 수량 등을) 줄이다,We should cut down on unnecessary expenses and save for a rainy day.,우리는 불필요한 지출을 줄이고 만일의 경우를 위해 저축해야 한다.,We should _ unnecessary expenses and save for a rainy day.,,cut down on
mortgage,담보 대출,They have already paid off the mortgage on their home.,그들은 집에 대한 담보 대출을 이미 다 갚았다.,They have already paid off the _ on their home.,,mortgage
mortgage,(토지쉼표 재산을) 저당 잡히다,He mortgaged his house to obtain the cash needed to start a company.,그는 창업에 필요한 현금을 구하기 위해 집을 저당 잡혔다.,He _ his house to obtain the cash needed to start a company.,,mortgaged
loan,대출쉼표 대부금,Luke will apply for a loan to buy the car.,Luke는 그 차를 사기 위해 대출을 신청할 것이다.,Luke will apply for a _ to buy the car.,,loan
in the red,적자인,Declining product sales have left us in the red.,상품 판매량의 감소는 우리를 적자로 만들었다.,Declining product sales have left us _.,,in the red
statement,입출금 내역서 / 성명쉼표 진술,You will receive a monthly bank statement listing your account activity.,귀하의 계좌 활동을 열거한 월별 은행 입출금 내역서를 받으실 것입니다.,You will receive a monthly bank _ listing your account activity.,,statement
statement,입출금 내역서 / 성명쉼표 진술,The government plans to make a statement regarding health care.,정부는 의료 보험에 관한 성명을 발표할 계획이다.,The government plans to make a _ regarding health care.,,statement
recession,불경기쉼표 경기 침체,Despite the recession쉼표 management has decided to raise employee salaries.,불경기에도 불구하고쉼표 경영진은 직원 임금을 인상하기로 결정했다.,Despite the _쉼표 management has decided to raise employee salaries.,,recession
stimulate,활발하게 하다쉼표 자극하다,Consumer spending is encouraged to stimulate the economy.,소비자 지출은 경제를 활발하게 하기 위해 장려된다.,Consumer spending is encouraged to _ the economy.,,stimulate
galvanize,활기를 불어넣다쉼표 자극하다,The high real estate prices galvanized owners into selling their properties.,높은 부동산 가격은 소유주들이 부동산을 매각하도록 활기를 불어넣었다.,The high real estate prices _ owners into selling their properties.,,galvanized
ensure,보장하다쉼표 반드시 ~이게 하다,he worked hard to ensure the financial security of his family.,그는 가족의 경제적 안정을 보장하기 위해 열심히 일했다.,he worked hard to _ the financial security of his family.,,ensure
compensate,보상하다쉼표 배상하다 / 보충하다,The company compensated the employee for the industrial accident.,그 회사는 직원의 산재에 대해 보상했다.,The company _ the employee for the industrial accident.,,compensated
compensate,보상하다쉼표 배상하다 / 보충하다,He will work weekends to compensate for his absences.,그는 결근을 보충하기 위해 주말에 일할 것이다.,He will work weekends to _ for his absences.,,compensate
account,계좌,I will open an account with a local bank.,나는 지역 은행에 계좌를 개설할 것이다.,I will open an _ with a local bank.,,account
plummet,(가격쉼표 물가 등이) 폭락하다,The prices of consumer goods plummeted last month.,지난달에 소비재의 가격이 폭락했다.,The prices of consumer goods _ last month.,,plummeted
remuneration,보수쉼표 보상,The contract guaranteed remuneration for all overtime.,그 계약서는 모든 추가 근무에 대한 보수를 보장했다.,The contract guaranteed _ for all overtime.,,remuneration
reimburse,변제하다쉼표 배상하다`,Your travel expenses will be reimbursed after you submit the receipts.,귀하의 여행 경비는 영수증을 제출하신 후 변제될 것입니다.,Your travel expenses will be _ after you submit the receipts.,,reimbursed
deficit,적자 / 부족쉼표 부족액,The government따옴표s budget deficit increased in the first quarter.,1분기에 정부 예산 적자가 증가했다.,The government따옴표s budget _ increased in the first quarter.,,deficit
deficit,적자 / 부족쉼표 부족액,many business borrow money to cover capital deficits.,많은 회사들이 자금 부족을 메우기 위해 돈을 빌린다.,many business borrow money to cover capital _.,,deficits
currency,화폐쉼표 통화,Where can I exchange currency at the airport?,공항 어디에서 화폐를 환전할 수 있습니까?,Where can I exchange _ at the airport?,,currency
subsidy,보조금,Public schools receive an annual subsidy from the government.,공립 학교들은 정부로부터 연간 보조금을 받는다.,Public schools receive an annual _ from the government.,,subsidy
redeem,(쿠폰 등을) 현금쉼표 상품으로 교환하다.,Gift certificates may be redeemed for cash.,상품권은 현금으로 교환될 수 있다.,Gift certificates may be _ for cash.,,redeemed
tally up,총계하다쉼표 합계하다,The accountant tallied up the expenses of the recent business seminar., 그 회계사는 최근의 사업 세미나 비용을 총계했다.,The accountant _ the expenses of the recent business seminar.,,tallied up
disparity,격차쉼표 불균형,This economic policy could reduce the disparity between the rich and poor.,이 경제 정책은 빈부 격차를 감소시킬 수 있다.,This economic policy could reduce the _ between the rich and poor.,,disparity
budget,예산,The budget for business trips was reduced.,출장 경비 예산이 삭감되었다.,The _ for business trips was reduced.,,budget
endow,기부하다,The wealthy businessman promised to endow the orphanage with funds.,그 부유한 사업가는 고아원에 자금을 기부하기로 약속했다.,The wealthy businessman promised to _ the orphanage with funds.,,endow
skyrocket,급등하다쉼표 치솟다,Company sales skyrocketed during an advertising campaign.,회사의 매출은 광고 캠페인 기간 동안 급등했다.,Company sales _ during an advertising campaign.,,skyrocketed
rebound,(가격 등이) 반등하다,Investors are optimistic that an increase in demand will cause house prices to rebound.,투자자들은 수요의 증가가 집값을 반등하도록 할 것이라고 낙관한다.,Investors are optimistic that an increase in demand will cause house prices to _.,,rebound
persistent,계속되는쉼표 끊임없이 지속되는 / 집요한,Poverty is a persistent problem in many countries.,빈곤은 많은 나라에서 계속되는 문제이다.,Poverty is a _ problem in many countries.,,persistent
persistent,계속되는쉼표 끊임없이 지속되는 / 집요한,Scientists are persistent in finding answers to their questions.,과학자들은 의문에 대한 해답을 찾는 데 있어 집요하다.,Scientists are _ in finding answers to their questions.,,persistent
abundant ,풍부한,Thanks to it abundant natural resources쉼표 the US has become a leading industrial nation.,풍부한 천연자원 덕분에쉼표 미국은 주요 산업국이 되었다.,Thanks to it _ natural resources쉼표 the US has become a leading industrial nation.,,abundant
eliminate,없애다쉼표 제거하다,International governments must work together to eliminate poverty.,국제 정부들은 빈곤을 없애기 위해 협력해야 한다.,International governments must work together to _ poverty.,,eliminate
stock,주식 / 재고,The director owns more than half of the company따옴표s stock.,그 이사는 회사 주식의 반 이상을 소유하고 있다.,The director owns more than half of the company따옴표s _.,,stock
stock,주식 / 재고,The computer store has many new models in stock.,그 컴퓨터 상점에는 신모델의 재고가 많다.,The computer store has many new models in _.,,stock
stock,보관하다쉼표 두다,The old books were stocked in a warehouse.,오래된 책들은 창고에 보관되어 있었다.,The old books were _ in a warehouse.,,stocked
moratorium,지불 유예,The company placed a moratorium on online orders until the security program was fixed.,회사는 보안 프로그램이 고쳐질 때까지 온라인 주문을 지불 정지 상태로 두었다.,The company placed a _ on online orders until the security program was fixed.,,moratorium
parity,동등쉼표 동격,All shareholders have parity with regard to the amount of shares in the company.,모든 주주들은 회사 주식의 양에 있어서 동등하다.,All shareholders have _ with regard to the amount of shares in the company.,,parity
pitch in ,(자금 등을 지원하며) 협력하다,Local businesses were asked to pitch in to help rebuild the youth center.,지역 기업들은 청소년 수련관을 재건하도록 돕는 것에 협력할 것을 요청받았다.,Local businesses were asked to _ to help rebuild the youth center.,,pitch in
rig,(부정한 수법으로) 조작하다,The system was rigged in favor of large corporations and small businesses could not compete.,그 시스템은 대기업에 유리하도록 조작되어 소기업들은 경쟁할 수 없었다.,The system was _ in favor of large corporations and small businesses could not compete.,,rigged
fund,(사업 등에) 자금을 대다,Donations were used to fund a tree-planting project.,기부금은 나무 심기 사업에 자금을 대는 데 사용되었다.,Donations were used to _ a tree-planting project.,,fund
prospect,전망쉼표 예상,The prospect of rising gas prices has focused people to use public transportation.,유가 상승 전망은 사람들이 대중교통을 이용하게 했다.,The _ of rising gas prices has focused people to use public transportation.,,prospect
appraise,(가치쉼표 가격을) 감정하다쉼표 평가하다,The expert appraised the diamond at more than a thousand dollars.,그 전문가는 그 다이아몬드를 1000달러 이상으로 감정했다.,The expert _ the diamond at more than a thousand dollars.,,appraised
recoup,(손실 등을) 되찾다쉼표 만회하다,Darren failed to recoup his savings after the stock market crash.,Darren은 주식 시장이 붕괴한 뒤 예금을 되찾는 데 실패했다.,Darren failed to _ his savings after the stock market crash.,,recoup
plunge,떨어지다쉼표 급락하다 / 뛰어들다,Fuel prices plunged to a record low this morning.,연료 가격이 오늘 아침에 사상 최저치로 떨어졌다.,Fuel prices _ to a record low this morning.,,plunged
plunge,떨어지다쉼표 급락하다 / 뛰어들다,The young men plunged into the river to save their friend.,그 젊은이들은 친구를 구하기 위해 강물로 뛰어들었다.,The young men _ into the river to save their friend.,,plunged
demand,수요쉼표 수요량,Demand for our products should increase as the holidays approach.,우리 상품에 대한 수요는 휴일이 다가옴에 따라 증가할 것이다.,_ for our products should increase as the holidays approach.,,Demand
demand,요구하다,The angry diner demanded to see the manager of the restaurant.,화가 난 식당 손님은 식당의 지배인과 만나기를 요구했다.,The angry diner _ to see the manager of the restaurant.,,demanded
unfettered,자유로운쉼표 제한받지 않는,Only the manager has unfettered access to all of the store따옴표s financial information.,매니저만 가게 재무 정보에 대해 자유로운 접근 권한이 있다.,Only the manager has _ access to all of the store따옴표s financial information.,,unfettered
deposit,(은행에) 예금하다 / 퇴적시키다,I deposited some of my salary into a bank account.,나는 월급의 일부를 은행 계좌에 예금했다.,I _ some of my salary into a bank account.,,deposited
deposit,(은행에) 예금하다 / 퇴적시키다,These minerals were deposited underground millions of years ago.,이 광물들은 수백만 년 전에 땅속에 퇴적되었다.,These minerals were _ underground millions of years ago.,,deposited
deposit,보증금쉼표 계약금,Your deposit will be refunded once the contract ends.,귀하의 보증금은 계약이 끝나면 환불될 것입니다.,Your _ will be refunded once the contract ends.,,deposit
crisis,위기,Several manufacturers closed down during the economic crisis.,여러 제조 회사들이 경제 위기 동안에 문을 닫았다.,Several manufacturers closed down during the economic _.,,crisis
sustain,유지하다쉼표 지속하다,The committee outlined a business strategy to sustain growth.,위원회는 성장을 유지하기 위해 사업 전략의 개요를 짰다.,The committee outlined a business strategy to _ growth.,,sustain
property,부동산쉼표 재산 / 특징,He sold his property to raise money for a world tour.,그는 세계 여행을 할 돈을 마련하려고 자신의 부동산을 팔았다.,He sold his _ to raise money for a world tour.,,property
property,부동산쉼표 재산 / 특징,the sales of soap with antibacterial properties have skyrocketed.,항균성이 특징인 비누의 판매량이 급증했다.,the sales of soap with antibacterial _ have skyrocketed.,,properties
trade,거래하다쉼표 무역하다,the two countries finally reached an agreement to trade certain agricultural goods.,두 나라는 마침내 특정한 농산품을 거래하기로 합의했다.,the two countries finally reached an agreement to _ certain agricultural goods.,,trade
fake,가짜의,Fake designer goods are so well made that sales of the real products are falling.,가짜 디자이너 제품들이 너무 잘 만들어져서 진품들의 판매량이 감소하고 있다.,_ designer goods are so well made that sales of the real products are falling.,,Fake
fall,떨어지다쉼표 급락하다 / 뛰어들다,The value of gold rarely falls쉼표 which makes it a good investment.,금의 가치는 좀처럼 떨어지지 않는데쉼표 이것은 금이 유리한 투자대상이 되게 한다.,The value of gold rarely _쉼표 which makes it a good investment.,,falls
soar,치솟다쉼표 급상승하다 ,The demand for cars decreased as the cost of gasoline soared.,휘발유 가격이 치솟음에 따라 자동차 수요가 감소했다.,The demand for cars decreased as the cost of gasoline _.,,soared
